module_id,contains,payload_sequence,payload_length_bp,terminal_stop_included,left_overhang,right_overhang,sequence_status,resource_scope,notes
pForge-Fusion-HiBiT,HiBiT,ATGGGTAGCGGTTGGCGGCTGTTCAAGAAGATCAGCTAA,39,True,AGGA,TGCC,curated_stage7_payload_sequence,stage7_virtual_allele_payload_not_full_plasmid,Minimal N-terminal Met-HiBiT payload for virtual edited-CDS simulation; terminal stop included.
pForge-Fusion-GFP11,GFP11,ATGCGTGATCACATGGTGCTGCATGAATATGTGAATGCTGCTGGTATTACCTAA,54,True,AGGA,TGCC,curated_stage7_payload_sequence,stage7_virtual_allele_payload_not_full_plasmid,Minimal N-terminal Met-GFP11 peptide payload for virtual edited-CDS simulation; terminal stop included.
pForge-Fusion-ddDegron,ddDegron,ATGGATGATGAGCTGTACAAGGACGACGACGACAAGGCTGCTGCCTAA,48,True,AGGA,TGCC,provisional_stage7_payload_sequence,stage7_virtual_allele_payload_not_full_plasmid,Compact ddDegron simulation payload resource; replace with full Addgene module map when definitive GenBank is bundled.
pForge-Fusion-LID,LIDdegron,ATGCTGGCCGATCTGGAAAAGGACGACGACGACAAGGCTGCTGCCTAA,48,True,AGGA,TGCC,provisional_stage7_payload_sequence,stage7_virtual_allele_payload_not_full_plasmid,Compact LID degron simulation payload resource; replace with full Addgene module map when definitive GenBank is bundled.
pForge-Fusion-p2A-EGFP,p2A_EGFP,ATGGGCGCCACCAACTTCTCCCTGCTGAAGCAGGCTGGCGACGTGGAGGAGAATCCCGGCCCTGCTTAA,69,True,AGGA,TGCC,provisional_stage7_payload_sequence,stage7_virtual_allele_payload_not_full_plasmid,Compact p2A-EGFP simulation payload resource; not a complete EGFP coding sequence.
pForge-Fusion-HiBiT-p2A-EGFP,Hibit_p2A_EGFP,ATGGGTAGCGGTTGGCGGCTGTTCAAGAAGATCAGCGGCGCCACCAACTTCTCCCTGCTGAAGCAGGCTGGCGACGTGGAGGAGAATCCCGGCCCTGCTTAA,102,True,AGGA,TGCC,provisional_stage7_payload_sequence,stage7_virtual_allele_payload_not_full_plasmid,HiBiT plus compact p2A-EGFP simulation payload resource; terminal stop included.
pForge-Fusion-dTAG,dTAG,ATGGATACCGAGGAGATCCTGGAGAAGGACGACGACGACAAGGCTGCTGCCTAA,54,True,AGGA,TGCC,provisional_stage7_payload_sequence,stage7_virtual_allele_payload_not_full_plasmid,Compact dTAG simulation payload resource; replace with full FKBP12F36V module map when definitive GenBank is bundled.
